,name,pop,lat,lon
0,"Чемальский район, Республика Алтай",9441,51.3122021,86.3102811344
1,"Чойский район, Республика Алтай",8348,51.6447599,86.6566981226
2,"Горно-Алтайск, Республика Алтай",56933,51.9577738,85.9641795
3,"Кош-Агачский район, Республика Алтай",18263,49.7161278,88.2261777188
4,"Майминский район, Республика Алтай",28642,51.86990085,85.9991711753
5,"Онгудайский район, Республика Алтай",15046,50.74112365,86.3687137823
6,"Шебалинский район, Республика Алтай",13596,51.35548075,85.4490176845
7,"Турочакский район, Республика Алтай",12484,51.9409355,87.4843653037
8,"Улаганский район, Республика Алтай",11388,50.836405,88.3901591969
9,"Усть-Канский район, Республика Алтай",15007,50.86036045,84.8692994191
10,"Усть-Коксинский район, Республика Алтай",17020,50.08797775,85.8339139962
11,"Алейск, Алтайский край",29510,52.4949124,82.7813297
12,"Алейский район, Алтайский край",16800,52.47869465,82.4165336894
13,"Алтайский район, Алтайский край",25645,51.8125693,85.3401256406
14,"Баевский район, Алтайский край",10979,53.31422885,80.6223525154
15,"Барнаул, Алтайский край",670332,53.3473762,83.7784101
16,"Белокуриха, Алтайский край",14661,51.9991958,84.9932092
17,"Бийск, Алтайский край",219328,52.5394905,85.2148673
18,"Бийский район, Алтайский край",34067,52.60491745,85.5598451548
19,"Благовещенский район, Алтайский край",30783,52.89226595,80.0257597448
20,"Бурлинский район, Алтайский край",12042,53.31443775,78.3064187922
21,"Быстроистокский район, Алтайский край",10150,52.3290599,84.3232048127
22,"Чарышский район, Алтайский край",12337,51.23714235,83.7240995162
23,"Целинный район, Алтайский край",16403,52.9639197,85.7717791761
24,"Хабарский район, Алтайский край",16431,53.55981535,79.4645405038
25,"Яровое, Алтайский край",18604,52.9195913,78.5636651
26,"Егорьевский район, Алтайский край",14170,51.71470935,80.9528423687
27,"Ельцовский район, Алтайский край",6339,53.24958685,86.219510018
28,"Калманский район, Алтайский край",14331,53.02527245,83.4070623893
29,"Камень-на-Оби, Алтайский край",44648,53.7897515,81.3485022
30,"Каменский район, Алтайский край",12025,53.73023125,81.2964742466
31,"Ключевский район, Алтайский край",18267,52.2451263,79.4275627956
32,"Косихинский район, Алтайский край",17927,53.3342475,84.6449101674
33,"Красногорский район, Алтайский край",16228,52.32422245,86.2455006121
34,"Краснощёковский район, Алтайский край",19251,51.52822375,82.9073102536
35,"Крутихинский район, Алтайский край",11301,54.0621767,80.962417881
36,"Кулундинский район, Алтайский край",23000,52.59806895,79.0983491572
37,"Курьинский район, Алтайский край",11079,51.47243845,82.2725042158
38,"Кытмановский район, Алтайский край",13896,53.4901958,85.3230361754
39,"Локтевский район, Алтайский край",29658,51.0328411,81.480137566
40,"Мамонтовский район, Алтайский край",23412,52.706443,81.8267608584
41,"Михайловский район, Алтайский край",21211,51.83890285,79.6258463567
42,"Немецкий национальный район, Алтайский край",17668,53.3273816,79.0994527705
43,"Новичихинский район, Алтайский край",9938,52.13683405,81.3484511481
44,"Новоалтайск, Алтайский край",70437,53.3933421,83.9394049
45,"Панкрушихинский район, Алтайский край",13364,53.79181035,80.3198098732
46,"Павловский район, Алтайский край",40235,53.2627179,83.0152114127
47,"Первомайский район, Алтайский край",50100,53.42403745,84.1669867381
48,"Петропавловский район, Алтайский край",12450,52.1059208,84.1404009814
49,"Поспелихинский район, Алтайский край",24788,51.87301105,81.8697089732
50,"Ребрихинский район, Алтайский край",24559,53.00450885,82.3206946529
51,"Родинский район, Алтайский край",20719,52.53593445,80.1624591568
52,"Романовский район, Алтайский край",13179,52.59259575,81.0648819226
53,"Рубцовск, Алтайский край",147002,51.5276918,81.216377
54,"Рубцовский район, Алтайский край",24556,51.56896535,81.494783817
55,"Шелаболихинский район, Алтайский край",13678,53.48429285,82.2083245594
56,"Сибирский, Алтайский край",11306,53.5574895,83.8387973
57,"Шипуновский район, Алтайский край",33285,52.1745934,82.3781482677
58,"Славгород, Алтайский край",43350,53,78.6385725
59,"Смоленский район, Алтайский край",23955,52.13307865,84.9515799702
60,"Солонешенский район, Алтайский край",10720,51.6182578,84.4041955345
61,"Солтонский район, Алтайский край",8610,52.80491345,86.5213864555
62,"Советский район, Алтайский край",16467,52.23815825,85.5412102088
63,"Суетский район, Алтайский край",5120,53.28151105,79.9130063853
64,"Табунский район, Алтайский край",10057,52.85176685,79.112441554
65,"Тальменский район, Алтайский край",46770,53.7905333,83.2965326236
66,"Тюменцевский район, Алтайский край",15695,53.24914115,81.5081564036
67,"Тогульский район, Алтайский край",8478,53.48538105,86.1763997798
68,"Топчихинский район, Алтайский край",23350,52.73055995,83.5043770849
69,"Третьяковский район, Алтайский край",14197,50.96161395,82.2988214682
70,"Троицкий район, Алтайский край",24868,52.830903,84.3937012872
71,"Угловский район, Алтайский край",13888,51.28976965,80.1610942094
72,"Усть-Калманский район, Алтайский край",15365,51.9895684,83.1980164566
73,"Усть-Пристанский район, Алтайский край",13409,52.31371655,83.5913398862
74,"Волчихинский район, Алтайский край",19703,52.04552445,80.4021048704
75,"Залесовский район, Алтайский край",15074,54.1205551,84.5579542518
76,"Заринск, Алтайский край",48461,53.7036062,84.9267129
77,"Заринский район, Алтайский край",20136,53.8535537,85.473945194
78,"Завьяловский район, Алтайский край",19305,52.8627713,81.0120222078
79,"Змеиногорский район, Алтайский край",21022,51.21893775,82.1300978551
80,"Зональный район, Алтайский край",19676,52.6729632,84.8242293193
81,"Баргузинский район, Республика Бурятия",23598,53.73539465,109.784600272
82,"Баунтовский эвенкийский район, Республика Бурятия",9667,54.387856,113.560436214
83,"Бичурский район, Республика Бурятия",25352,50.5766892,107.638182329
84,"Хоринский район, Республика Бурятия",18467,52.4290635,109.517969733
85,"Джидинский район, Республика Бурятия",29352,50.8125667,105.171892601
86,"Иволгинский район, Республика Бурятия",37983,51.707504,106.988530227
87,"Еравнинский район, Республика Бурятия",18705,52.77851955,112.456675278
88,"Кабанский район, Республика Бурятия",59883,51.9436066,106.428711694
89,"Кижингинский район, Республика Бурятия",16509,51.7558405,110.18029612
90,"Кяхтинский район, Республика Бурятия",39785,50.386,106.595127511
91,"Курумканский район, Республика Бурятия",15007,54.77050295,111.097193598
92,"Мухоршибирский район, Республика Бурятия",24969,51.086338,107.815106999
93,"Муйский район, Республика Бурятия",13142,56.41989285,114.457415026
94,"Окинский район, Республика Бурятия",5353,52.5466897,100.160371597
95,"Прибайкальский район, Республика Бурятия",26856,52.6642055,108.105335439
96,"Селенгинский район, Республика Бурятия",46427,51.0806624,106.237243368
97,"Северобайкальск, Республика Бурятия",24929,55.6359677,109.3356457
98,"Северо-Байкальский район, Республика Бурятия",14035,55.5715097,109.966495874
99,"Тарбагатайский район, Республика Бурятия",16476,51.45691825,107.578210647
100,"Тункинский район, Республика Бурятия",22672,51.51785455,102.257356588
101,"Улан-Удэ, Республика Бурятия",404426,51.8357478,107.583657
102,"Заиграевский район, Республика Бурятия",49975,51.88465705,108.314816596
103,"Закаменский район, Республика Бурятия",28453,50.72682505,103.243017245
104,"Абакан, Республика Хакасия",165214,53.7152883,91.4388763
105,"Абаза, Республика Хакасия",17115,52.6501041,90.0901717
106,"Алтайский район, Республика Хакасия",25559,53.4403565,91.466021217
107,"Аскизский район, Республика Хакасия",40912,53.2973766,89.8978932069
108,"Бейский район, Республика Хакасия",19305,52.99776135,90.8861916394
109,"Боградский район, Республика Хакасия",15869,54.43700905,90.9557553787
110,"Черногорск, Республика Хакасия",74773,53.8282354,91.3132105
111,"Орджоникидзевский район, Республика Хакасия",12841,54.85991715,89.432806381
112,"Саяногорск, Республика Хакасия",63322,53.0893866,91.4113979
113,"Ширинский район, Республика Хакасия",29371,54.4393137,89.81569721
114,"Сорск, Республика Хакасия",12143,53.9956476,90.2469501
115,"Таштыпский район, Республика Хакасия",16582,52.223752,89.5538511278
116,"Усть-Абаканский район, Республика Хакасия",39397,53.7277425,90.3838535255
117,"Аларский район, Иркутская область",21479,53.3118587,102.748432732
118,"Ангарский район, Иркутская область",245577,52.41066355,103.795221461
119,"Баяндаевский район, Иркутская область",11529,53.18564785,105.725521475
120,"Балаганский район, Иркутская область",9194,54.64486205,102.813828357
121,"Боханский район, Иркутская область",25398,53.10399235,103.955747564
122,"Бодайбинский район, Иркутская область",23227,58.53476205,116.385472288
123,"Братск, Иркутская область",246319,56.1632985,101.6112811
124,"Братский район, Иркутская область",56878,55.9086309,102.063601624
125,"Черемхово, Иркутская область",52647,53.1484336,103.0701416
126,"Черемховский район, Иркутская область",30114,52.7652813,102.076113176
127,"Чунский район, Иркутская область",36516,56.8223125,99.5982692245
128,"Эхирит-Булагатский район, Иркутская область",30597,52.90802985,104.735616064
129,"Иркутск, Иркутская область",587891,52.2895979,104.2805843
130,"Иркутский район, Иркутская область",84322,52.36064145,105.279674054
131,"Качугский район, Иркутская область",17388,54.09918755,106.594268177
132,"Катангский район, Иркутская область",3779,60.9748441,107.509570032
133,"Казачинско-Ленский район, Иркутская область",18829,56.1087988,107.916160123
134,"Киренский район, Иркутская область",20322,57.76091245,109.068689904
135,"Куйтунский район, Иркутская область",31856,54.4616396,101.679269049
136,"Мамско-Чуйский район, Иркутская область",5501,58.14086095,112.151457965
137,"Нижнеилимский район, Иркутская область",55096,56.82483175,103.609279805
138,"Нижнеудинский район, Иркутская область",69423,54.4642309,97.8603640731
139,"Нукутский район, Иркутская область",15743,53.74948405,102.919349541
140,"Ольхонский район, Иркутская область",9446,53.4540343,107.727344195
141,"Осинский район, Иркутская область",20431,53.6456401,104.001128569
142,"Саянск, Иркутская область",40800,54.1084177,102.1695219
143,"Шелеховский район, Иркутская область",62378,52.054798,103.872411716
144,"Слюдянский район, Иркутская область",40509,51.5609097,103.914251231
145,"Свирск, Иркутская область",13650,53.0662708,103.3423344
146,"Тайшетский район, Иркутская область",79519,56.23481605,98.1371648325
147,"Тулун, Иркутская область",44611,54.5620941,100.5792153
148,"Тулунский район, Иркутская область",27285,54.159519,100.163445081
149,"Усолье-Сибирское, Иркутская область",83327,52.7511598,103.6620796
150,"Усольский район, Иркутская область",50334,52.43180525,103.174455945
151,"Усть-Илимск, Иркутская область",86610,57.9594717,102.7341943
152,"Усть-Илимский район, Иркутская область",18589,58.01803175,103.799579466
153,"Усть-Кутский район, Иркутская область",53791,56.95631825,105.67806047
154,"Усть-Удинский район, Иркутская область",14385,54.9979675,103.795302338
155,"Заларинский район, Иркутская область",28229,53.2905872,101.552435392
156,"Жигаловский район, Иркутская область",9340,54.82926545,105.203690338
157,"Зима, Иркутская область",32508,53.9284009,102.0527304
158,"Зиминский район, Иркутская область",13383,53.88211135,101.561697117
159,"Анжеро-Судженский городской округ, Кемеровская область",82497,56.02869905,86.0601297443
160,"Беловский городской округ, Кемеровская область",134513,54.392031,86.3193666622
161,"Беловский район, Кемеровская область",30204,54.33882005,86.6060301902
162,"Берёзовский городской округ, Кемеровская область",49510,55.64930225,86.2862740019
163,"Чебулинский район, Кемеровская область",16348,55.7849489,87.4835736541
164,"Гурьевский район, Кемеровская область",43883,54.37034065,85.6174302936
165,"Ижморский район, Кемеровская область",13517,56.1407571,86.8061151653
166,"Яйский район, Кемеровская область",20383,56.2338691,86.1185311677
167,"Яшкинский район, Кемеровская область",30856,55.9170696,85.559836985
168,"Юрга, Кемеровская область",81533,55.7135987,84.9347993
169,"Юргинский район, Кемеровская область",22448,55.7621619,84.742347679
170,"Калтанский городской округ, Кемеровская область",21892,53.48714825,87.2663149678
171,"Кемерово, Кемеровская область",532981,55.3551248,86.0872319
172,"Кемеровский район, Кемеровская область",45459,55.483686,86.5258161976
173,"Киселевский городской округ, Кемеровская область",103019,53.9969387,86.5735239
174,"Крапивинский район, Кемеровская область",24533,54.9840298,87.0562342706
175,"Краснобродский городской округ, Кемеровская область",14895,54.155526,86.4404512344
176,"Ленинск-Кузнецкий, Кемеровская область",103938,54.6654427,86.1661141
177,"Ленинск-Кузнецкий район, Кемеровская область",23760,54.66044215,85.8321576543
178,"Мариинский район, Кемеровская область",57811,56.38585725,87.6220062869
179,"Междуреченский городской округ, Кемеровская область",103946,53.7803208,88.4957952002
180,"Мысковский городской округ, Кемеровская область",45375,53.63635875,87.8328033343
181,"Новокузнецк, Кемеровская область",547904,53.7576081,87.1360984
182,"Новокузнецкий район, Кемеровская область",50681,53.8625415,87.6487874763
183,"Осинниковский городской округ, Кемеровская область",60918,53.65058615,87.3871545647
184,"Полысаевский городской округ, Кемеровская область",30671,54.57034185,86.2707527766
185,"Прокопьевск, Кемеровская область",210130,53.8909703,86.7376598
186,"Прокопьевский район, Кемеровская область",31442,53.98216135,86.2646328444
187,"Промышленновский район, Кемеровская область",50106,54.8847018,85.5703905641
188,"Тайгинский городской округ, Кемеровская область",27424,56.08666395,85.7260816127
189,"Таштагольский район, Кемеровская область",55029,52.76074845,88.0757853408
190,"Тисульский район, Кемеровская область",25045,55.29240865,87.8238198915
191,"Тяжинский район, Кемеровская область",25597,56.0743536,88.7652705258
192,"Топкинский район, Кемеровская область",44887,55.3580071,85.3527826534
193,"Абанский район, Красноярский край",22577,57.00457335,96.7036188579
194,"Ачинск, Красноярский край",110448,56.2694846,90.4953964
195,"Ачинский район, Красноярский край",15870,56.27343855,90.7597866073
196,"Балахтинский район, Красноярский край",21000,55.27014545,92.2169042308
197,"Берёзовский район, Красноярский край",37868,55.7904638,92.8513219161
198,"Бирилюсский район, Красноярский край",10927,57.29256165,90.6939303818
199,"Боготол, Красноярский край",21051,56.2114647,89.5316422
200,"Боготольский район, Красноярский край",11267,56.23208575,89.9150715632
201,"Богучанский район, Красноярский край",47968,58.6270237,97.0704898647
202,"Большемуртинский район, Красноярский край",19115,56.96528895,92.9870114802
203,"Большеулуйский район, Красноярский край",7658,56.61144985,90.7250374065
204,"Бородино, Красноярский край",17416,55.8992103,94.8945997
205,"Дивногорск, Красноярский край",32193,55.959645,92.3754183
206,"Дзержинский район, Красноярский край",14552,56.84442275,94.9708286492
207,"Эвенкийский район, Красноярский край",16253,64.26957825,99.5609120982
208,"Идринский район, Красноярский край",12472,54.5475421,92.5833811181
209,"Иланский район, Красноярский край",25899,56.040311,96.0997468373
210,"Ирбейский район, Красноярский край",16784,55.1605818,96.0267694398
211,"Емельяновский район, Красноярский край",46306,56.30308655,92.3666192443
212,"Енисейск, Красноярский край",18766,58.4532212,92.1748169
213,"Енисейский район, Красноярский край",27223,59.5216235,89.5708586794
214,"Ермаковский район, Красноярский край",20918,52.6074834,93.131990149
215,"Канск, Красноярский край",94226,56.2059969,95.7067883
216,"Канский район, Красноярский край",27281,56.2022414,95.2332300513
217,"Каратузский район, Красноярский край",16036,53.3379822,93.6574577248
218,"Казачинский район, Красноярский край",11430,57.5936062,93.3023065499
219,"Кедровый, Красноярский край",4692,55.9934551,92.1959779
220,"Кежемский район, Красноярский край",22072,58.69365265,100.592726595
221,"Козульский район, Красноярский край",16689,56.2466013,91.2885361407
222,"Красноярск, Красноярский край",974591,56.0082657,92.8706219
223,"Краснотуранский район, Красноярский край",15562,54.4161314,91.5400268767
224,"Курагинский район, Красноярский край",47690,54.12280675,94.0658172745
225,"Лесосибирск, Красноярский край",66240,58.223511,92.4859683
226,"Манский район, Красноярский край",16077,55.4083311,93.5913980899
227,"Минусинск, Красноярский край",73948,53.7003261,91.6972375
228,"Минусинский район, Красноярский край",25872,53.75317415,92.0970059147
229,"Мотыгинский район, Красноярский край",16200,58.6921102,94.4204596164
230,"Назарово, Красноярский край",52817,56.0115922,90.418506
231,"Назаровский район, Красноярский край",23547,55.808287,90.4257615311
232,"Нижнеингашский район, Красноярский край",33439,56.3012346,96.8856921532
233,"Норильск, Красноярский край",176252,69.3498394,88.200517
234,"Новосёловский район, Красноярский край",14135,54.95688225,91.1511111287
235,"Партизанский район, Красноярский край",10254,55.02031355,94.1539911477
236,"Пировский район, Красноярский край",7572,57.53053,91.9901930391
237,"Рыбинский район, Красноярский край",31941,55.97352365,94.910269618
238,"Саянский район, Красноярский край",12002,54.9183902,94.9501656855
239,"Шарыпово, Красноярский край",48814,55.535505,89.1864312
240,"Шарыповский район, Красноярский край",15109,55.51788945,88.929488862
241,"Северо-Енисейский район, Красноярский край",11119,59.92186385,93.1763559956
242,"Солнечный, Красноярский край",10384,55.2834507,89.8257343
243,"Сосновоборск, Красноярский край",33091,56.1214937,93.3387286
244,"Сухобузимский район, Красноярский край",20537,56.5642198,93.6707947265
245,"Шушенский район, Красноярский край",33216,52.71868755,91.8646292777
246,"Таймырский Долгано-Ненецкий район, Красноярский край",34432,74.36669555,96.5890181576
247,"Тасеевский район, Красноярский край",13255,57.3841439,94.8441401606
248,"Тюхтетский район, Красноярский край",8858,57.0914254,89.1644451399
249,"Туруханский район, Красноярский край",18708,64.5777904,88.0648037648
250,"Уярский район, Красноярский край",21932,55.8973637,94.1673573044
251,"Ужурский район, Красноярский край",33739,55.33511115,90.1125600632
252,"Зеленогорск, Красноярский край",66056,56.1135612,94.5892803
253,"Железногорск, Красноярский край",93841,56.250937,93.5328569
